{"schema":"o-mcp/subgraph","version":1,"query":{"tenant":3,"root":"WTP1_IN_1","as_of":"2026-10-21","depth":3,"utility":null,"direction":"down"},"nodes":[{"id":142,"code":"WTP1_IN_1","name":"WTP-1 Intake 1","class":"SOURCE","type":"WATER_INTAKE","attrs":{},"scope":"reached","depth":0,"children_total":1,"children_not_included":0},{"id":147,"code":"WTP1_RAW","name":"WTP-1 Raw Water","class":"STORAGE","type":"WATER_TANK","attrs":{},"scope":"reached","depth":1,"children_total":1,"children_not_included":0},{"id":141,"code":"WTP1_CLR","name":"WTP-1 Clarifier","class":"TREATMENT","type":"CLARIFIER","attrs":{},"scope":"reached","depth":2,"children_total":2,"children_not_included":0},{"id":150,"code":"WTP1_SOFT_1","name":"WTP-1 Softener 1","class":"TREATMENT","type":"SOFTENER","attrs":{},"scope":"reached","depth":3,"children_total":1,"children_not_included":1},{"id":151,"code":"WTP1_SOFT_2","name":"WTP-1 Softener 2","class":"TREATMENT","type":"SOFTENER","attrs":{},"scope":"reached","depth":3,"children_total":1,"children_not_included":1},{"id":143,"code":"WTP1_IN_2","name":"WTP-1 Intake 2","class":"SOURCE","type":"WATER_INTAKE","attrs":{},"scope":"parent","depth":null,"children_total":1,"children_not_included":0},{"id":146,"code":"WTP1_RAN","name":"WTP-1 Tandon Air Hujan","class":"SOURCE","type":"WATER_INTAKE","attrs":{},"scope":"parent","depth":null,"children_total":1,"children_not_included":0}],"edges":[{"id":197,"from":"WTP1_CLR","to":"WTP1_SOFT_1","type":"WATER_TREATMENT","class":"PIPE","utility":"WATER","carries_flow":true,"effective_from":"-infinity","effective_to":null},{"id":198,"from":"WTP1_CLR","to":"WTP1_SOFT_2","type":"WATER_TREATMENT","class":"PIPE","utility":"WATER","carries_flow":true,"effective_from":"-infinity","effective_to":null},{"id":199,"from":"WTP1_IN_1","to":"WTP1_RAW","type":"WATER_TREATMENT","class":"PIPE","utility":"WATER","carries_flow":true,"effective_from":"-infinity","effective_to":null},{"id":200,"from":"WTP1_IN_2","to":"WTP1_RAW","type":"WATER_TREATMENT","class":"PIPE","utility":"WATER","carries_flow":true,"effective_from":"-infinity","effective_to":null},{"id":201,"from":"WTP1_RAN","to":"WTP1_RAW","type":"WATER_TREATMENT","class":"PIPE","utility":"WATER","carries_flow":true,"effective_from":"-infinity","effective_to":null},{"id":202,"from":"WTP1_RAW","to":"WTP1_CLR","type":"WATER_TREATMENT","class":"PIPE","utility":"WATER","carries_flow":true,"effective_from":"-infinity","effective_to":null}],"findings":[{"code":"IMPLICIT_BUS","node":"WTP1_CLR","children":2,"message":"WTP1_CLR is not a bus but feeds 2 children directly, so the busbar they share on site has no node of its own."}]}
