{"schema":"o-mcp/subgraph","version":1,"query":{"tenant":3,"root":"LVMDB_A4","as_of":"2026-10-21","depth":1,"utility":null,"direction":"down"},"nodes":[{"id":74,"code":"LVMDB_A4","name":"LVMDB_A4","class":"BUS","type":"MAIN_LV_BOARD","attrs":{"nominal_v":400,"rated_kva":2000,"tx_primary_v":20000,"main_breaker_a":3200,"tx_equipment_code":"TF_A4"},"scope":"reached","depth":0,"children_total":4,"children_not_included":0},{"id":188,"code":"CB_A4","name":"Capacitor Bank A4","class":"STORAGE","type":"CAPACITOR_BANK","attrs":{"steps":4,"control":"APFC","rated_v":400,"step_kvar":[25,25,50,50],"target_pf":0.98,"rated_kvar":150,"detuned_pct":null,"site_status":"normal","site_status_as_of":"2026-09-21"},"scope":"reached","depth":1,"children_total":0,"children_not_included":0},{"id":34,"code":"COMP_SCR2200","name":"Comp SCR2200","class":"CONVERSION","type":"AIR_COMPRESSOR","attrs":{"rated_kw":250,"main_breaker_a":800},"scope":"reached","depth":1,"children_total":0,"children_not_included":0},{"id":38,"code":"COOLING2","name":"Cooling Tower A4","class":"LOAD","type":"PUMP","attrs":{"main_breaker_a":400},"scope":"reached","depth":1,"children_total":0,"children_not_included":0},{"id":138,"code":"WORKSHOP","name":"Workshop","class":"LOAD","type":"GENERIC_LOAD","attrs":{"main_breaker_a":250},"scope":"reached","depth":1,"children_total":0,"children_not_included":0},{"id":40,"code":"FACTORY_AB","name":"Incoming Factory A&B","class":"BUS","type":"MV_BUS","attrs":{"nominal_v":20000,"main_breaker_a":630},"scope":"parent","depth":null,"children_total":6,"children_not_included":5},{"id":122,"code":"PLTS_A4","name":"PLTS A4","class":"SOURCE","type":"PV_PLANT","attrs":{},"scope":"parent","depth":null,"children_total":1,"children_not_included":0},{"id":61,"code":"INCOMING_PLN","name":"Incoming PLN 1","class":"SOURCE","type":"GRID_INCOMER","attrs":{"nominal_v":20000,"tariff_code":"I3","contract_kva":7585,"main_breaker_a":630},"scope":"context","depth":null,"children_total":6,"children_not_included":5}],"edges":[{"id":22,"from":"FACTORY_AB","to":"LVMDB_A4","type":"TRANSFORMER","class":"FEEDER","utility":"ELECTRICITY","carries_flow":true,"effective_from":"-infinity","effective_to":null},{"id":41,"from":"INCOMING_PLN","to":"FACTORY_AB","type":"GRID_INFEED","class":"FEEDER","utility":"ELECTRICITY","carries_flow":true,"effective_from":"-infinity","effective_to":null},{"id":327,"from":"LVMDB_A4","to":"CB_A4","type":"PF_COMPENSATION","class":"COMPENSATION","utility":"ELECTRICITY","carries_flow":false,"effective_from":"-infinity","effective_to":null},{"id":61,"from":"LVMDB_A4","to":"COMP_SCR2200","type":"SUPPLY_LV","class":"FEEDER","utility":"ELECTRICITY","carries_flow":true,"effective_from":"-infinity","effective_to":null},{"id":62,"from":"LVMDB_A4","to":"COOLING2","type":"SUPPLY_LV","class":"FEEDER","utility":"ELECTRICITY","carries_flow":true,"effective_from":"-infinity","effective_to":null},{"id":63,"from":"LVMDB_A4","to":"WORKSHOP","type":"SUPPLY_LV","class":"FEEDER","utility":"ELECTRICITY","carries_flow":true,"effective_from":"-infinity","effective_to":null},{"id":356,"from":"PLTS_A4","to":"LVMDB_A4","type":"PV_INJECTION","class":"FEEDER","utility":"ELECTRICITY","carries_flow":true,"effective_from":"-infinity","effective_to":null}],"findings":[{"code":"IMPLICIT_BUS","node":"INCOMING_PLN","children":6,"message":"INCOMING_PLN is not a bus but feeds 6 children directly, so the busbar they share on site has no node of its own."}]}
