{"schema":"o-mcp/subgraph","version":1,"query":{"tenant":3,"root":"LVMDP_SPINNING_3","as_of":"2026-10-21","depth":2,"utility":null,"direction":"down"},"nodes":[{"id":82,"code":"LVMDP_SPINNING_3","name":"LVMDP Spinning 3","class":"BUS","type":"MAIN_LV_BOARD","attrs":{"nominal_v":400,"rated_kva":2000,"tx_primary_v":20000,"main_breaker_a":3200,"tx_equipment_code":"TF_SPINNING_3"},"scope":"reached","depth":0,"children_total":4,"children_not_included":0},{"id":8,"code":"AHU_LINE3","name":"AHU Line 3","class":"LOAD","type":"AHU","attrs":{},"scope":"reached","depth":1,"children_total":0,"children_not_included":0},{"id":183,"code":"CB_SPINNING_3","name":"Capacitor Bank Spinning 3","class":"STORAGE","type":"CAPACITOR_BANK","attrs":{"steps":12,"control":"APFC","rated_v":400,"step_kvar":[40,40,40,40,40,40,40,40,40,40,40,40],"target_pf":0.98,"rated_kvar":480,"detuned_pct":null,"site_status":"normal","site_status_as_of":"2026-09-21"},"scope":"reached","depth":1,"children_total":0,"children_not_included":0},{"id":83,"code":"LVSDP_COMP_23","name":"LVSDP Compressor 2 & 3","class":"BUS","type":"SUB_BOARD","attrs":{"nominal_v":400},"scope":"reached","depth":1,"children_total":2,"children_not_included":0},{"id":84,"code":"LVSDP_PROD_ATY","name":"LVSDP Produksi ATY","class":"BUS","type":"SUB_BOARD","attrs":{"nominal_v":400},"scope":"reached","depth":1,"children_total":1,"children_not_included":0},{"id":21,"code":"COMP_AIKI","name":"Comp Aiki","class":"CONVERSION","type":"AIR_COMPRESSOR","attrs":{"rated_kw":110},"scope":"reached","depth":2,"children_total":0,"children_not_included":0},{"id":30,"code":"COMP_INTERLACE","name":"Comp Interlace","class":"BUS","type":"SUB_BOARD","attrs":{"nominal_v":400},"scope":"reached","depth":2,"children_total":8,"children_not_included":8},{"id":35,"code":"COMP_WINDER","name":"Comp Winder","class":"BUS","type":"SUB_BOARD","attrs":{"nominal_v":400},"scope":"reached","depth":2,"children_total":5,"children_not_included":5},{"id":61,"code":"INCOMING_PLN","name":"Incoming PLN 1","class":"SOURCE","type":"GRID_INCOMER","attrs":{"nominal_v":20000,"tariff_code":"I3","contract_kva":7585,"main_breaker_a":630},"scope":"parent","depth":null,"children_total":6,"children_not_included":5}],"edges":[{"id":47,"from":"INCOMING_PLN","to":"LVMDP_SPINNING_3","type":"TRANSFORMER","class":"FEEDER","utility":"ELECTRICITY","carries_flow":true,"effective_from":"-infinity","effective_to":null},{"id":133,"from":"LVMDP_SPINNING_3","to":"AHU_LINE3","type":"SUPPLY_LV","class":"FEEDER","utility":"ELECTRICITY","carries_flow":true,"effective_from":"-infinity","effective_to":null},{"id":322,"from":"LVMDP_SPINNING_3","to":"CB_SPINNING_3","type":"PF_COMPENSATION","class":"COMPENSATION","utility":"ELECTRICITY","carries_flow":false,"effective_from":"-infinity","effective_to":null},{"id":135,"from":"LVMDP_SPINNING_3","to":"LVSDP_COMP_23","type":"SUPPLY_LV","class":"FEEDER","utility":"ELECTRICITY","carries_flow":true,"effective_from":"-infinity","effective_to":null},{"id":136,"from":"LVMDP_SPINNING_3","to":"LVSDP_PROD_ATY","type":"SUPPLY_LV","class":"FEEDER","utility":"ELECTRICITY","carries_flow":true,"effective_from":"-infinity","effective_to":null},{"id":137,"from":"LVSDP_COMP_23","to":"COMP_INTERLACE","type":"SUPPLY_LV","class":"FEEDER","utility":"ELECTRICITY","carries_flow":true,"effective_from":"-infinity","effective_to":null},{"id":363,"from":"LVSDP_COMP_23","to":"COMP_WINDER","type":"SUPPLY_LV","class":"FEEDER","utility":"ELECTRICITY","carries_flow":true,"effective_from":"-infinity","effective_to":null},{"id":138,"from":"LVSDP_PROD_ATY","to":"COMP_AIKI","type":"SUPPLY_LV","class":"FEEDER","utility":"ELECTRICITY","carries_flow":true,"effective_from":"-infinity","effective_to":null}],"findings":[{"code":"IMPLICIT_BUS","node":"INCOMING_PLN","children":6,"message":"INCOMING_PLN is not a bus but feeds 6 children directly, so the busbar they share on site has no node of its own."},{"code":"PROPERTY_GAP","node":"COMP_INTERLACE","property":"main_breaker_a","kind":"NAMEPLATE","status":"MISSING","used_by":"harmonics_report.py loading denominator and small-load filter","detail":null,"message":"COMP_INTERLACE has no main_breaker_a (missing), which harmonics_report.py loading denominator and small-load filter needs."},{"code":"PROPERTY_GAP","node":"COMP_WINDER","property":"main_breaker_a","kind":"NAMEPLATE","status":"MISSING","used_by":"harmonics_report.py loading denominator and small-load filter","detail":null,"message":"COMP_WINDER has no main_breaker_a (missing), which harmonics_report.py loading denominator and small-load filter needs."},{"code":"PROPERTY_GAP","node":"LVSDP_COMP_23","property":"main_breaker_a","kind":"NAMEPLATE","status":"MISSING","used_by":"harmonics_report.py loading denominator and small-load filter","detail":null,"message":"LVSDP_COMP_23 has no main_breaker_a (missing), which harmonics_report.py loading denominator and small-load filter needs."},{"code":"PROPERTY_GAP","node":"LVSDP_PROD_ATY","property":"main_breaker_a","kind":"NAMEPLATE","status":"MISSING","used_by":"harmonics_report.py loading denominator and small-load filter","detail":null,"message":"LVSDP_PROD_ATY has no main_breaker_a (missing), which harmonics_report.py loading denominator and small-load filter needs."}]}
