{"schema":"o-mcp/subgraph","version":1,"query":{"tenant":3,"root":"GAS_ENGINE","as_of":"2026-10-21","depth":1,"utility":null,"direction":"down"},"nodes":[{"id":46,"code":"GAS_ENGINE","name":"Gas Engine","class":"SOURCE","type":"GAS_ENGINE","attrs":{"fuel":"NATURAL_GAS"},"scope":"reached","depth":0,"children_total":3,"children_not_included":0},{"id":71,"code":"LVMDB_A1","name":"LVMDB A1","class":"BUS","type":"MAIN_LV_BOARD","attrs":{"nominal_v":400,"rated_kva":2000,"tx_primary_v":20000,"main_breaker_a":3200,"tx_equipment_code":"TF_A1"},"scope":"reached","depth":1,"children_total":6,"children_not_included":6},{"id":72,"code":"LVMDB_A2","name":"LVMDB A2","class":"BUS","type":"MAIN_LV_BOARD","attrs":{"nominal_v":400,"rated_kva":2000,"tx_primary_v":20000,"main_breaker_a":3200,"tx_equipment_code":"TF_A2"},"scope":"reached","depth":1,"children_total":9,"children_not_included":9},{"id":73,"code":"LVMDB_A3","name":"LVMDB_A3","class":"BUS","type":"MAIN_LV_BOARD","attrs":{"nominal_v":400,"rated_kva":2000,"tx_primary_v":20000,"main_breaker_a":3200,"tx_equipment_code":"TF_A3"},"scope":"reached","depth":1,"children_total":1,"children_not_included":1},{"id":40,"code":"FACTORY_AB","name":"Incoming Factory A&B","class":"BUS","type":"MV_BUS","attrs":{"nominal_v":20000,"main_breaker_a":630},"scope":"parent","depth":null,"children_total":6,"children_not_included":3},{"id":61,"code":"INCOMING_PLN","name":"Incoming PLN 1","class":"SOURCE","type":"GRID_INCOMER","attrs":{"nominal_v":20000,"tariff_code":"I3","contract_kva":7585,"main_breaker_a":630},"scope":"context","depth":null,"children_total":6,"children_not_included":5}],"edges":[{"id":19,"from":"FACTORY_AB","to":"LVMDB_A1","type":"TRANSFORMER","class":"FEEDER","utility":"ELECTRICITY","carries_flow":true,"effective_from":"-infinity","effective_to":null},{"id":20,"from":"FACTORY_AB","to":"LVMDB_A2","type":"TRANSFORMER","class":"FEEDER","utility":"ELECTRICITY","carries_flow":true,"effective_from":"-infinity","effective_to":null},{"id":21,"from":"FACTORY_AB","to":"LVMDB_A3","type":"TRANSFORMER","class":"FEEDER","utility":"ELECTRICITY","carries_flow":true,"effective_from":"-infinity","effective_to":null},{"id":28,"from":"GAS_ENGINE","to":"LVMDB_A1","type":"GENERATOR_INFEED","class":"FEEDER","utility":"ELECTRICITY","carries_flow":true,"effective_from":"-infinity","effective_to":null},{"id":29,"from":"GAS_ENGINE","to":"LVMDB_A2","type":"GENERATOR_INFEED","class":"FEEDER","utility":"ELECTRICITY","carries_flow":true,"effective_from":"-infinity","effective_to":null},{"id":30,"from":"GAS_ENGINE","to":"LVMDB_A3","type":"GENERATOR_INFEED","class":"FEEDER","utility":"ELECTRICITY","carries_flow":true,"effective_from":"-infinity","effective_to":null},{"id":41,"from":"INCOMING_PLN","to":"FACTORY_AB","type":"GRID_INFEED","class":"FEEDER","utility":"ELECTRICITY","carries_flow":true,"effective_from":"-infinity","effective_to":null}],"findings":[{"code":"IMPLICIT_BUS","node":"GAS_ENGINE","children":3,"message":"GAS_ENGINE is not a bus but feeds 3 children directly, so the busbar they share on site has no node of its own."},{"code":"IMPLICIT_BUS","node":"INCOMING_PLN","children":6,"message":"INCOMING_PLN is not a bus but feeds 6 children directly, so the busbar they share on site has no node of its own."}]}
