{"schema":"o-mcp/subgraph","version":1,"query":{"tenant":3,"root":"WTP_1","as_of":"2026-10-21","depth":2,"utility":null,"direction":"down"},"nodes":[{"id":175,"code":"WTP_1","name":"WTP 1","class":"LOAD","type":"PUMP","attrs":{"main_breaker_a":630},"scope":"reached","depth":0,"children_total":0,"children_not_included":0},{"id":79,"code":"LVMDB_TF630","name":"LVMDB TF 630kVA","class":"BUS","type":"MAIN_LV_BOARD","attrs":{"nominal_v":400,"rated_kva":630,"tx_primary_v":20000,"main_breaker_a":1250,"tx_equipment_code":"TF_TWISTING"},"scope":"parent","depth":null,"children_total":4,"children_not_included":3},{"id":61,"code":"INCOMING_PLN","name":"Incoming PLN 1","class":"SOURCE","type":"GRID_INCOMER","attrs":{"nominal_v":20000,"tariff_code":"I3","contract_kva":7585,"main_breaker_a":630},"scope":"context","depth":null,"children_total":6,"children_not_included":5}],"edges":[{"id":44,"from":"INCOMING_PLN","to":"LVMDB_TF630","type":"TRANSFORMER","class":"FEEDER","utility":"ELECTRICITY","carries_flow":true,"effective_from":"-infinity","effective_to":null},{"id":125,"from":"LVMDB_TF630","to":"WTP_1","type":"SUPPLY_LV","class":"FEEDER","utility":"ELECTRICITY","carries_flow":true,"effective_from":"-infinity","effective_to":null}],"findings":[{"code":"IMPLICIT_BUS","node":"INCOMING_PLN","children":6,"message":"INCOMING_PLN is not a bus but feeds 6 children directly, so the busbar they share on site has no node of its own."}]}
