{"schema":"o-mcp/subgraph","version":1,"query":{"tenant":3,"root":"INCOMING_PLN","as_of":"2026-10-21","depth":1,"utility":null,"direction":"down"},"nodes":[{"id":61,"code":"INCOMING_PLN","name":"Incoming PLN 1","class":"SOURCE","type":"GRID_INCOMER","attrs":{"nominal_v":20000,"tariff_code":"I3","contract_kva":7585,"main_breaker_a":630},"scope":"reached","depth":0,"children_total":6,"children_not_included":0},{"id":40,"code":"FACTORY_AB","name":"Incoming Factory A&B","class":"BUS","type":"MV_BUS","attrs":{"nominal_v":20000,"main_breaker_a":630},"scope":"reached","depth":1,"children_total":6,"children_not_included":6},{"id":78,"code":"LVMDB_TEXTURE_2","name":"LVMDB Texture TF 2000kVA","class":"BUS","type":"MAIN_LV_BOARD","attrs":{"nominal_v":400,"rated_kva":2000,"tx_primary_v":20000,"main_breaker_a":3200,"tx_equipment_code":"TF_TEXTURE_2000"},"scope":"reached","depth":1,"children_total":18,"children_not_included":18},{"id":79,"code":"LVMDB_TF630","name":"LVMDB TF 630kVA","class":"BUS","type":"MAIN_LV_BOARD","attrs":{"nominal_v":400,"rated_kva":630,"tx_primary_v":20000,"main_breaker_a":1250,"tx_equipment_code":"TF_TWISTING"},"scope":"reached","depth":1,"children_total":4,"children_not_included":4},{"id":80,"code":"LVMDP_SPINNING_1","name":"LVMDP Spinning 1","class":"BUS","type":"MAIN_LV_BOARD","attrs":{"nominal_v":400,"rated_kva":2000,"tx_primary_v":20000,"main_breaker_a":3200,"tx_equipment_code":"TF_SPINNING_1"},"scope":"reached","depth":1,"children_total":8,"children_not_included":8},{"id":81,"code":"LVMDP_SPINNING_2","name":"LVMDP Spinning 2","class":"BUS","type":"MAIN_LV_BOARD","attrs":{"nominal_v":400,"rated_kva":1600,"tx_primary_v":20000,"main_breaker_a":3200,"tx_equipment_code":"TF_SPINNING_2"},"scope":"reached","depth":1,"children_total":2,"children_not_included":2},{"id":82,"code":"LVMDP_SPINNING_3","name":"LVMDP Spinning 3","class":"BUS","type":"MAIN_LV_BOARD","attrs":{"nominal_v":400,"rated_kva":2000,"tx_primary_v":20000,"main_breaker_a":3200,"tx_equipment_code":"TF_SPINNING_3"},"scope":"reached","depth":1,"children_total":4,"children_not_included":4},{"id":124,"code":"PLTS_TEXTURE","name":"PLTS Texture","class":"SOURCE","type":"PV_PLANT","attrs":{"main_breaker_a":2000},"scope":"parent","depth":null,"children_total":1,"children_not_included":0}],"edges":[{"id":41,"from":"INCOMING_PLN","to":"FACTORY_AB","type":"GRID_INFEED","class":"FEEDER","utility":"ELECTRICITY","carries_flow":true,"effective_from":"-infinity","effective_to":null},{"id":43,"from":"INCOMING_PLN","to":"LVMDB_TEXTURE_2","type":"TRANSFORMER","class":"FEEDER","utility":"ELECTRICITY","carries_flow":true,"effective_from":"-infinity","effective_to":null},{"id":44,"from":"INCOMING_PLN","to":"LVMDB_TF630","type":"TRANSFORMER","class":"FEEDER","utility":"ELECTRICITY","carries_flow":true,"effective_from":"-infinity","effective_to":null},{"id":45,"from":"INCOMING_PLN","to":"LVMDP_SPINNING_1","type":"TRANSFORMER","class":"FEEDER","utility":"ELECTRICITY","carries_flow":true,"effective_from":"-infinity","effective_to":null},{"id":46,"from":"INCOMING_PLN","to":"LVMDP_SPINNING_2","type":"TRANSFORMER","class":"FEEDER","utility":"ELECTRICITY","carries_flow":true,"effective_from":"-infinity","effective_to":null},{"id":47,"from":"INCOMING_PLN","to":"LVMDP_SPINNING_3","type":"TRANSFORMER","class":"FEEDER","utility":"ELECTRICITY","carries_flow":true,"effective_from":"-infinity","effective_to":null},{"id":359,"from":"PLTS_TEXTURE","to":"LVMDB_TEXTURE_2","type":"PV_INJECTION","class":"FEEDER","utility":"ELECTRICITY","carries_flow":true,"effective_from":"-infinity","effective_to":null}],"findings":[{"code":"IMPLICIT_BUS","node":"INCOMING_PLN","children":6,"message":"INCOMING_PLN is not a bus but feeds 6 children directly, so the busbar they share on site has no node of its own."}]}
